136,"I never really use [THIS MODEL] except for the popup that google gives whenever we search on Google, in that case it provides a good overview I think",1 — Not at all likely,"Explaining complex concepts simply,Brainstorming or generating creative ideas",4 — Often,"Math computations,Writing or debugging code,Data processing or analysis,Writing or editing essays/reports,Drafting professional text (e.g., emails, résumés)","This model really can't do any math computations without making some sort of mistake, with computational stuff it's okay since it's easy to verify but with proofs or like really difficult questions it just gives the wrong answer completely",3 — Sometimes,5 — Very often,"Similar to the previous two, I ask a professor or check online for supporting evidence. I do it a lot more for [THIS MODEL] though.",Gemini
137,"Brainstorming ideas, dealing with daily puzzles, learning knowledge, writing drafts, summarizing texts.",4 — Likely,"Writing or debugging code,Explaining complex concepts simply,Converting content between formats (e.g., LaTeX),Writing or editing essays/reports,Drafting professional text (e.g., emails, résumés),Brainstorming or generating creative ideas",2 — Rarely,"Math computations,Data processing or analysis,Brainstorming or generating creative ideas",I asked it to show the proof of a math question. The middle steps were skipped and logically incorrect. I found this suboptimal because the confident tone made the mistake harder to notice.,3 — Sometimes,4 — Often,"I usually cross-check the online sources or with the slides, academic articles, or just testing directly.",ChatGPT
137,"Writing code, editing program, and anything related to computer.",4 — Likely,"Writing or debugging code,Data processing or analysis,Converting content between formats (e.g., LaTeX),Brainstorming or generating creative ideas",2 — Rarely,"Math computations,Writing or debugging code,Writing or editing essays/reports,Drafting professional text (e.g., emails, résumés)",I once asked it to write a Python function. The code itself had errors and wouldn’t run. This was suboptimal because clarity in the explanation didn’t make up for the technical inaccuracy.,4 — Often,3 — Sometimes,"I usually verify by comparing with other models, running the code if relevant, or searching online to confirm the facts.",Claude
137,Nothing.,1 — Not at all likely,,1 — Never,,Never used.,1 — Never,1 — Never,Never used.,Gemini
138,having it verify understanding and explain concepts. Although not always reliable,4 — Likely,"Math computations,Converting content between formats (e.g., LaTeX)",3 — Sometimes,"Writing or debugging code,Data processing or analysis,Explaining complex concepts simply,Writing or editing essays/reports","It almost never explains math simply, it just gives you something like a textbook definition. Its suboptimal because its not really doing anything that I cant just simply google and it's also wrong sometimes",4 — Often,5 — Very often,"watch a video, google or textbook",ChatGPT
138,I've never used it but the same as the ones I would use [ANOTHER MODEL] for,3 — Neutral / Unsure,"Math computations,Writing or debugging code,Data processing or analysis,Explaining complex concepts simply,Converting content between formats (e.g., LaTeX),Brainstorming or generating creative ideas",1 — Never,"Math computations,Writing or debugging code,Data processing or analysis,Explaining complex concepts simply,Converting content between formats (e.g., LaTeX),Writing or editing essays/reports,Drafting professional text (e.g., emails, résumés),Brainstorming or generating creative ideas",I've never used it so I'm not sure,5 — Very often,5 — Very often,"Google,textbooks or YouTube",Claude
138,"explaining math concepts and verifying computations, finding bugs in code",3 — Neutral / Unsure,"Math computations,Writing or debugging code,Data processing or analysis,Explaining complex concepts simply,Converting content between formats (e.g., LaTeX),Brainstorming or generating creative ideas",1 — Never,"Math computations,Writing or debugging code,Data processing or analysis,Explaining complex concepts simply,Converting content between formats (e.g., LaTeX),Writing or editing essays/reports,Drafting professional text (e.g., emails, résumés),Brainstorming or generating creative ideas",I've never used it so I'm not sure,5 — Very often,5 — Very often,"if I did use it:google, textbook, or YouTube same as any ai model",Gemini
139,"Learning new topics, getting summaries, details explained for things I don't understand. Generating practice questions and getting understanding assessed. Rephrasing written work.",5 — Very likely,"Writing or debugging code,Explaining complex concepts simply,Writing or editing essays/reports,Drafting professional text (e.g., emails, résumés),Brainstorming or generating creative ideas",3 — Sometimes,"Math computations,Data processing or analysis","When I do practice problems/exercises to study with [THIS MODEL], I find it will often tell me my response is wrong. I find this is either because it always converts to decimal and doesn't leave an answer in a fraction, or just doesn't fully look at my response. When it goes through the calculation or work in detail, it then says ""oh yeah looks like you were right"".",2 — Rarely,3 — Sometimes,"I normally ask it. I critically think about the response it gives, and then if I am suspicious about parts of its response, I'll ask it if it about my suspicions. If not, I might turn to Google.",ChatGPT
139,"Studying and learning new concepts, practice problems for studying.",4 — Likely,"Math computations,Writing or debugging code,Data processing or analysis,Explaining complex concepts simply,Writing or editing essays/reports,Drafting professional text (e.g., emails, résumés)",2 — Rarely,Brainstorming or generating creative ideas,"I haven't used [THIS MODEL] very much, but it lacks a bit of personality, so its brainstorming and generation of creative ideas are suboptimal. It seems to fall a little short on originality.",2 — Rarely,3 — Sometimes,"Like [ANOTHER MODEL], I ask it to reflect on what I am skeptical on. I find that it often agrees with the criticism it is provided with. So doing a Google search to reference check is a good idea.",Claude
139,"Research, learning, short answers and summaries of content I'm interested in.",2 — Unlikely,"Math computations,Explaining complex concepts simply,Writing or editing essays/reports",3 — Sometimes,Brainstorming or generating creative ideas,"[THIS MODEL] seems to be less creative than other GenAI models. As a test, I asked it generate startup ideas, but it refused because business ideation is outside of its guidelines. I do appreciate that it has boundaries. However, I didn't get a response, so that could be considered suboptimal.",5 — Very often,2 — Rarely,Check the references it provides and judge whether or not they seem reliable.,Gemini
140, Making grocery lists  Making reminders  Graphing data  Asking basic questions  Explaining concepts  Asking for elaboration on topics,2 — Unlikely,"Writing or debugging code,Explaining complex concepts simply,Converting content between formats (e.g., LaTeX)",3 — Sometimes,"Math computations,Data processing or analysis,Writing or editing essays/reports,Brainstorming or generating creative ideas","I was curious if it could solve a proof I was thinking about. It made incorrect assumptions, outputted the proof in the wrong format. It also gave the wrong final answer.",3 — Sometimes,5 — Very often,I would google to cross-reference what it says and sometimes I read some books to double check if the information cannot be found on Google. I also cross verify with other chat-bots.,ChatGPT
140, Checking code I have wrote  Debugging code  Writing analysis on code  Writing analysis on datasets  Analyzing datasets  Formatting datasets,3 — Neutral / Unsure,"Math computations,Writing or debugging code,Data processing or analysis,Explaining complex concepts simply,Brainstorming or generating creative ideas",3 — Sometimes,Writing or editing essays/reports,"It is suboptimal at writing essays/reports. It did not give a full response to the question I gave it, and it had unclear portions. It also had certain knowledge gaps and used too much jargon.",3 — Sometimes,5 — Very often,"I would verify it by checking with the other chat bots. I would also do a google search. On top of that, if applicable, I would go on sites such as Stack Overflow to see how similar answers are written to the problem I give it.",Claude
140, Grocery Lists  Rewriting phrases  Checking my answers to a problem  Brainstorming  Creative inspiration  Writing stories,2 — Unlikely,"Math computations,Writing or debugging code,Data processing or analysis,Converting content between formats (e.g., LaTeX),Brainstorming or generating creative ideas",2 — Rarely,Explaining complex concepts simply,"I asked it to explain a concept I had seen on the internet as it was pretty complex. It tried to tell me how it worked, but I found it to have too much jargon. I also cross referenced it with other sources, and found some errors in its response. It could have more directly addressed the question as well.",2 — Rarely,5 — Very often,"I would go check with relevant books in the public library. I would do a google search on the topic I was searching up. Also, I would cross-check with other chat bots. Finally, I would retry the same entry a few times to see if it will hallucinate.",Gemini
141,"I would use it for studying, anything that I don't understand, ask for advice for future planning.",4 — Likely,"Math computations,Writing or debugging code,Data processing or analysis,Explaining complex concepts simply,Writing or editing essays/reports,Drafting professional text (e.g., emails, résumés),Brainstorming or generating creative ideas",3 — Sometimes,"Converting content between formats (e.g., LaTeX)","I tried adding an ordered list to my resume in LaTeX, but none of the code that [THIS MODEL] gave me worked.",4 — Often,4 — Often,"The model will usually provide a link to the source it is refereeing to, and I will just click the link and check for the correctness.",ChatGPT
141,"I rarely use this model, but I often use it on tasks that can't be solved by [ANOTHER MODEL], and I just hope that [THIS MODEL] might works by luck.",1 — Not at all likely,"Writing or editing essays/reports,Drafting professional text (e.g., emails, résumés)",1 — Never,"Math computations,Writing or debugging code","I asked it to solve a math problem that involve proofs, but it was not able to solve it.",1 — Never,1 — Never,I would ask [ANOTHER MODEL] to generate a response as well with the same prompt and compare their answer.,Claude
141,"I never use it, but I heard people say it is good for coding.",1 — Not at all likely,Writing or debugging code,3 — Sometimes,"Converting content between formats (e.g., LaTeX),Writing or editing essays/reports",I heard people say that it often gives oversimplified respond.,1 — Never,1 — Never,Like before I would ask [ANOTHER MODEL] to generate a response as well and compare both responses.,Gemini
142,"[THIS MODEL] is a good all purpose GenAI model with widespread adoptions and plenty of documentation and users. It is good at coding, interpreting, analyzing, and summarizing content for the purposes of learning or projects. [THIS MODEL] is great for explaining concepts, creating lesson plans, exploring new ideas, debugging code, writing code, and converting content between languages in coding and spoken/written languages.",4 — Likely,"Math computations,Writing or debugging code,Data processing or analysis,Converting content between formats (e.g., LaTeX),Brainstorming or generating creative ideas",3 — Sometimes,"Explaining complex concepts simply,Drafting professional text (e.g., emails, résumés)","Sometimes if the prompt is too complex [THIS MODEL] can hallucinate or use wrong/outdated sources which will lead you on the wrong path. For example, when trying to setup my own home server I had [THIS MODEL] write up a basic guide of the apps I could use, but some of the options were either meant to fulfill different purposes or outdated and no longer supported. This is especially true if you specify in the prompt for qa certain number of results.",3 — Sometimes,4 — Often,"Google searches, and cross referencing with Wikipedia. On top of that I sometimes refresh the session and ask if the response was correct, and sometimes the AI is able to catch it's own errors.",ChatGPT
142,"[THIS MODEL] is amazing for coding, beyond that I have no other experience using it.",1 — Not at all likely,"Math computations,Writing or debugging code,Data processing or analysis",2 — Rarely,"Writing or editing essays/reports,Drafting professional text (e.g., emails, résumés)","[THIS MODEL] is great for coding, but when it comes to creativity it lacks in comparison to some other models. When it comes to writing or editing essays and reports the limited creativity of the model likely results in suboptimal responses.",3 — Sometimes,3 — Sometimes,"google searchs, check if the code works by running it and debugging the error",Claude
142,I have never used [THIS MODEL],1 — Not at all likely,"Math computations,Writing or debugging code",1 — Never,"Drafting professional text (e.g., emails, résumés)","I have never used [THIS MODEL], but I hear it also has a lack of creativity when it comes to writing so it likely has suboptimal writing responses",4 — Often,1 — Never,"cross reference with google and wikipedia, if code by running and debugging or stackoverflow",Gemini
143,debug,4 — Likely,"Explaining complex concepts simply,Converting content between formats (e.g., LaTeX),Writing or editing essays/reports,Drafting professional text (e.g., emails, résumés)",3 — Sometimes,"Math computations,Writing or debugging code","When I use [THIS MODEL] to do some calculations, it always gives me the wrong answer like 1+1 not equals to 2.",3 — Sometimes,4 — Often,"I asked [THIS MODEL] to debug my code, However, after changing the code as it suggested it's still not working.",ChatGPT
143,Writing/debugging code/answer maths questions,3 — Neutral / Unsure,Writing or debugging code,2 — Rarely,Data processing or analysis,actually I haven't met this situation as I don't use it often.,3 — Sometimes,3 — Sometimes,I verified by thinking if it makes sense or compare with some other ai models.,Claude
143,I ask some maths problems.,2 — Unlikely,Math computations,4 — Often,Math computations,it gives the result doesn't even make sense.,3 — Sometimes,3 — Sometimes,I calculate the answer manually or compare with other ai models.,Gemini
144,I would use these model to summarize big ideas and difficult concepts for me in a simple and understandable manner. E.g. providing a piece of text or a concept and asking the model to provide a definition or explaining it in simple terms.,4 — Likely,"Explaining complex concepts simply,Writing or editing essays/reports,Drafting professional text (e.g., emails, résumés),Brainstorming or generating creative ideas",4 — Often,"Math computations,Writing or debugging code,Data processing or analysis,Converting content between formats (e.g., LaTeX)",I asked for a simple mathematical calculation for a calculus question to double check my work. The answer that came up was complete wrong and the method in which the model got that answer was also wrong and strange.,3 — Sometimes,3 — Sometimes,I would conduct my own research online on the matter to see if the response provided was correct. If it were a calculation or coding related question I would also try to solve it myself and ask other people for help on checking whether it made sense.,ChatGPT
144,I would use this model to double check or debug my code. I would also use this model to grammar check pieces of text that I have written to see if they were grammatically correct or not.,4 — Likely,"Math computations,Writing or debugging code,Explaining complex concepts simply,Writing or editing essays/reports,Drafting professional text (e.g., emails, résumés)",2 — Rarely,Writing or debugging code,"I was using this model to analyze a small piece of code that was not working, I asked it to debug the code segment, after which it resulted in a response that did not manage to debug the code segment making it suboptimal.",3 — Sometimes,3 — Sometimes,I would verify the model’s response by checking other sources online for help and also asking my peers and seniors for help on checking my work and whether the response was valid.,Claude
144,I would use this model to help summarizing large chunks of text and help with conducting research on specific topics that confuse me.,3 — Neutral / Unsure,"Math computations,Explaining complex concepts simply,Writing or editing essays/reports,Drafting professional text (e.g., emails, résumés),Brainstorming or generating creative ideas",3 — Sometimes,"Explaining complex concepts simply,Writing or editing essays/reports",I was making a presentation on agentic AI and needed to do some research on the topic. I used this model to find me sources and articles of research. The articles that were found were either not related to the topic or too old to be relevant.,2 — Rarely,2 — Rarely,I would look at other models and sources online to verify the model’s response.,Gemini
145,"I would ask for definitions of simple tasks to [THIS MODEL]. I would also ask it to break down complex idea into easier, simple ideas to help me understand better.",4 — Likely,"Explaining complex concepts simply,Converting content between formats (e.g., LaTeX)",3 — Sometimes,"Math computations,Brainstorming or generating creative ideas","I was re-doing past midterms for one of my math courses. When I asked [THIS MODEL] to do one question, it did not match the answer from the answer sheet provided. It was suboptimal because they had calculation errors and gave me the wrong answer.",2 — Rarely,4 — Often,"Usually when it gives me ideas or facts, I ask to give me the link where they fetched the idea/fact from. Sometimes the link actually does not take me anywhere, so I need to be cautious and check every link they give me and see if they are legitamate.",ChatGPT
145,"Unfortunately, I have not used [THIS MODEL] ever. I believe it is best used to academics based on simple research I did just now.",3 — Neutral / Unsure,"Writing or editing essays/reports,Drafting professional text (e.g., emails, résumés)",3 — Sometimes,Math computations,"I believe it would give inaccurate mathematical responses, assuming it would make mistakes like [ANOTHER MODEL] would.",4 — Often,1 — Never,"Again, I do not use this model but it has been advertising for their well-known fact-based informations, so I assume it would give better verifying references than [ANOTHER MODEL].",Claude
145,I would use [THIS MODEL] for searching for articles and random facts. I would also ask for it to do some mathematical computations as well.,4 — Likely,"Math computations,Drafting professional text (e.g., emails, résumés)",2 — Rarely,Writing or debugging code,"Like other models, it makes its little mistakes from time to time. I once used it to debug but it was not able to fix my code or had the wrong idea of telling me the issue.",4 — Often,4 — Often,I would ask for resources and links to their statements.,Gemini
146,To simplify the advanced terminologies and concepts to better understand them.,3 — Neutral / Unsure,"Writing or debugging code,Data processing or analysis,Explaining complex concepts simply,Converting content between formats (e.g., LaTeX),Drafting professional text (e.g., emails, résumés),Brainstorming or generating creative ideas",3 — Sometimes,"Math computations,Writing or debugging code,Writing or editing essays/reports",It was a simple math question where I was studying for an exam and the department didn't give the answer. So I used [THIS MODEL] to check my answer and the logic it used as completely off.,3 — Sometimes,3 — Sometimes,I look it up myself or go to the website it used as a resource,ChatGPT
146,I have never used this,3 — Neutral / Unsure,"Math computations,Writing or debugging code",3 — Sometimes,Brainstorming or generating creative ideas,I have never used this,3 — Sometimes,3 — Sometimes,I have never used this,Claude
146,Brainstorms and for creative use,3 — Neutral / Unsure,"Writing or debugging code,Drafting professional text (e.g., emails, résumés),Brainstorming or generating creative ideas",3 — Sometimes,Data processing or analysis,I gave a specific instruction to export a pdf file as part of the response and it didn't export it.,2 — Rarely,2 — Rarely,Go look it up myself,Gemini
147,"I would use [THIS MODEL] to ask targeted questions about certain topics of interest that I would like to research more. Generically, I would use it to spontaneously collate many resources about a singular topic that I come across that interests me, either within or outside of an academic setting. For example, I may ask it questions about astronomy if I come across some interesting news, or ask it similarly about certain buzzwords in climate change and the like.",4 — Likely,"Explaining complex concepts simply,Writing or editing essays/reports,Drafting professional text (e.g., emails, résumés),Brainstorming or generating creative ideas",2 — Rarely,"Math computations,Writing or debugging code,Data processing or analysis","I once asked [THIS MODEL] to give me C++ code for a specific web programming scenario to use as reference. The response was generic, inappropriately commented (explained basic code but did not explain complex code), and failed to meet my needs as there was no clear explanation of how to write (e.g., through a step-by-step process) the same code if I wanted to do it myself.",1 — Never,4 — Often,"Since I usually don't see references within the responses that I get, I find myself looking for similar topic articles/sources through a web browser and verifying the claims of [THIS MODEL].",ChatGPT
147,"I would use [THIS MODEL] for almost anything programming related, whether that be debugging, explanation of complex ideas, or getting a baseline of things. Specifically it would lean more towards explanation of any ideas or concepts that I do not recognize, to try and understand code snippets better myself.",5 — Very likely,"Math computations,Writing or debugging code,Data processing or analysis,Explaining complex concepts simply,Drafting professional text (e.g., emails, résumés)",1 — Never,"Writing or editing essays/reports,Brainstorming or generating creative ideas","When writing/editing essays, I find that [THIS MODEL] has a very formulaic way of creative writing. Specifically, it uses broad generic topics and separates the larger heading by them, before dividing and conquering, rather than being able to ebb and flow between topics at large. This can generate a very ""unnatural"" way of writing as opposed to a more ""human"" approach.",1 — Never,4 — Often,"Similar to [ANOTHER MODEL], I will use third-party resources by searching for similar articles/sources online. If it is a conclusion that requires evidence, I will usually look for research that supplements [THIS MODEL]'s findings. If it is a concept or explanation of a topic, I will usually search for other sources that corroborate the same thing in different words.",Claude
147,"I will very often use [THIS MODEL] to quickly generate code or understand code snippets, usually for generating or dealing with CSS attributes/files. Additionally, I might also use [THIS MODEL] for creative writing purposes. I will also use [THIS MODEL] to get recent information on topics as it has access to the web for free, and often cites sources/YouTube videos on the topics I ask it about. I believe [THIS MODEL] also has the best ""human"" tone and personality when it comes to drafting messages/emails.",2 — Unlikely,"Writing or debugging code,Writing or editing essays/reports,Drafting professional text (e.g., emails, résumés),Brainstorming or generating creative ideas",2 — Rarely,Explaining complex concepts simply,"When asked about Linear Regression, [THIS MODEL] gave me a response that lacked fundamentals on the topic, but instead delved deeper than what a beginner would need. It also gave responses that felt longer than necessary, while I appreciated some more concise answers after referring back to [ANOTHER MODEL]/[ANOTHER MODEL]. Over the past few weeks, I have also noticed a degradation in my experience with [THIS MODEL] as I feel it may forget context mid-chat, and might run tangents on sub-par sourced information.",5 — Very often,2 — Rarely,"Usually as [THIS MODEL] cites its sources, I take the time to read through the sources and ensure that it is in line with what [THIS MODEL] responded. As I feel that [THIS MODEL] has become more unstable as of late, I might also use third-party sources by searching for articles on the same topic through a search engine.",Gemini
