69,"Translation, getting sample answers for practice questions, debugging.",4 — Likely,"Math computations,Writing or debugging code,Data processing or analysis,Brainstorming or generating creative ideas",3 — Sometimes,"Writing or editing essays/reports,Drafting professional text (e.g., emails, résumés)","For writing or editing essay, all contents generated by the model are superficial and not profound, even if I give it specific prompts. Because I can't get high marks for reports that generated by [THIS MODEL] model.",5 — Very often,4 — Often,"read it, then do it by myself, then search internet or post online.",ChatGPT
69,data processing.,1 — Not at all likely,"Math computations,Writing or debugging code,Data processing or analysis,Brainstorming or generating creative ideas",2 — Rarely,Writing or editing essays/reports,"For writing or editing essay, all contents generated by the model are superficial and not profound, even if I give it specific prompts.",4 — Often,4 — Often,"read it, then do it by myself, then search internet or post online.",Claude
69,coding.,3 — Neutral / Unsure,"Math computations,Writing or debugging code",4 — Often,Writing or debugging code,"When coding during lab, the code automatically provided by [THIS MODEL] sometimes cannot achieve my purpose.",2 — Rarely,3 — Sometimes,Search the related web or asking [ANOTHER MODEL].,Gemini
70,"Summarizing, explaining, feedback, ideas",4 — Likely,"Data processing or analysis,Explaining complex concepts simply,Converting content between formats (e.g., LaTeX),Drafting professional text (e.g., emails, résumés),Brainstorming or generating creative ideas",3 — Sometimes,"Writing or debugging code,Data processing or analysis,Writing or editing essays/reports","Response was normal, but the information was wrong, or didn’t work in the case of coding.",3 — Sometimes,4 — Often,"Check notes, or do a google search",ChatGPT
70,"Writing, summarizing, editing, analysis",3 — Neutral / Unsure,"Data processing or analysis,Explaining complex concepts simply,Writing or editing essays/reports,Drafting professional text (e.g., emails, résumés),Brainstorming or generating creative ideas",2 — Rarely,"Math computations,Writing or debugging code,Converting content between formats (e.g., LaTeX)","In writing code, will make simple mistakes or memory issues.",2 — Rarely,3 — Sometimes,"Analyze the response myself, google search, run and test the code if that is the task",Claude
70,"quick summaries, compiling references, coding, verifying my own answers.",4 — Likely,"Writing or debugging code,Data processing or analysis,Explaining complex concepts simply",2 — Rarely,"Explaining complex concepts simply,Writing or editing essays/reports,Brainstorming or generating creative ideas","When wanting a summary, it often gets facts wrongs or makes them up if it doesn’t know.",5 — Very often,3 — Sometimes,"Looking through the references it provided, to see if conclusion is true.",Gemini
71,I use this model for general knowledge questions and help explaining academic concepts.,4 — Likely,"Explaining complex concepts simply,Converting content between formats (e.g., LaTeX),Drafting professional text (e.g., emails, résumés),Brainstorming or generating creative ideas",3 — Sometimes,Math computations,"C programming questions, low level code.",4 — Often,3 — Sometimes,I usually verify from multiple sources.,ChatGPT
71,I use this for scientific-related tasks.,5 — Very likely,"Math computations,Writing or debugging code,Data processing or analysis,Writing or editing essays/reports",2 — Rarely,Brainstorming or generating creative ideas,It was not very good at generating ideas about a possible implementation of a software idea.,4 — Often,2 — Rarely,"I would check multiple other sources, if academic would check academic sources.",Claude
71,Generating academic writing.,2 — Unlikely,"Drafting professional text (e.g., emails, résumés),Brainstorming or generating creative ideas",3 — Sometimes,"Math computations,Writing or debugging code,Data processing or analysis","Math proofs regarding group theory, gives incorrect answer and completely wrong approach.",4 — Often,2 — Rarely,I would check the information from academic sources.,Gemini
72,Writing lengthy emails.,3 — Neutral / Unsure,"Explaining complex concepts simply,Converting content between formats (e.g., LaTeX),Drafting professional text (e.g., emails, résumés),Brainstorming or generating creative ideas",4 — Often,"Math computations,Writing or debugging code,Data processing or analysis,Writing or editing essays/reports","Searching for a complex statistic, such as what percentage of people graduate from UofT in 5 years with a GPA > 3.5. The response was a rough estimate, which I found suboptimal as I was looking for a more accurate figure.",4 — Often,3 — Sometimes,"Asking it to cite sources, then reading through the source and verifying any claims made.",ChatGPT
72,Programming the front-end of a website.,3 — Neutral / Unsure,Writing or debugging code,4 — Often,Data processing or analysis,"When attempting to solve complex cryptography puzzles. The response was the LLM failing to solve the puzzle, which was suboptimal as the puzzle was very straightforward.",2 — Rarely,2 — Rarely,"Asking it to cite sources in its training data, then reading through the source and verifying any claims made.",Claude
72,"Any project that requires LLMs, as [THIS MODEL] has free API access.",1 — Not at all likely,"Drafting professional text (e.g., emails, résumés),Brainstorming or generating creative ideas",3 — Sometimes,Writing or debugging code,"When writing complex CUDA code, the bot struggles to adhere to the latest standards and documentation.",1 — Never,1 — Never,"Similar to [ANOTHER MODEL], asking it to cite sources in its training data, then reading through the source and verifying any claims made.",Gemini
73,"I use this model for a variety of tasks, including refining my writing (such as emails, resumes, and essays), helping me understand difficult readings, and summarizing long passages. I also use it for debugging and writing code, searching for information, and finding useful websites.",4 — Likely,"Math computations,Writing or debugging code,Explaining complex concepts simply,Converting content between formats (e.g., LaTeX),Drafting professional text (e.g., emails, résumés)",3 — Sometimes,"Data processing or analysis,Writing or editing essays/reports,Brainstorming or generating creative ideas","One time, I was working on an essay proposal and asked the model to help brainstorm topics. The responses I received were either not creative enough or too complex to be practical.",5 — Very often,4 — Often,"When I verify a response from the model, I usually check it against the original text or source material if it’s related to a reading or a math problem. I also confirm by discussing it with friends or asking experts to make sure the information is accurate.",ChatGPT
73,I use the [THIS MODEL] model mainly for generating emails and for writing code.,3 — Neutral / Unsure,"Data processing or analysis,Converting content between formats (e.g., LaTeX),Writing or editing essays/reports,Drafting professional text (e.g., emails, résumés),Brainstorming or generating creative ideas",4 — Often,"Writing or debugging code,Data processing or analysis,Explaining complex concepts simply,Writing or editing essays/reports,Drafting professional text (e.g., emails, résumés)","When I ask the model to write a paragraph based on background information, it sometimes includes inaccurate details or leaves out parts of what I asked for. This becomes especially noticeable in longer conversations, where it seems to forget earlier instructions.",3 — Sometimes,4 — Often,"When I verify a response from the model, I usually check it against the original text or source material if it’s related to a reading or a math problem. I also confirm by discussing it with friends or asking experts to make sure the information is accurate.",Claude
73,"I use the model at work to help identify data insights I might have missed, figure out how to measure them, and incorporate them into the data I already have. I also use it for practical tasks like summarizing PDFs, writing emails, and coding.",2 — Unlikely,"Writing or editing essays/reports,Drafting professional text (e.g., emails, résumés),Brainstorming or generating creative ideas",4 — Often,"Math computations,Writing or debugging code,Data processing or analysis,Converting content between formats (e.g., LaTeX)","When I use it for daily tasks, it won’t play music, call someone, or send a message with just my voice unless I unlock my phone first.",2 — Rarely,2 — Rarely,"I will Cross-check with reliable sources like official websites, and for writing tasks I will compare it against assignment instructions or grading rubrics. Also, I will compare its answer with other AI models.",Gemini
74,"I would use this model to review emails before sending them, get hints on work when I'm stuck, and to do preliminary research on a new topic I'm learning about.",4 — Likely,"Writing or debugging code,Explaining complex concepts simply,Drafting professional text (e.g., emails, résumés),Brainstorming or generating creative ideas",4 — Often,"Math computations,Writing or debugging code,Data processing or analysis,Converting content between formats (e.g., LaTeX),Brainstorming or generating creative ideas","I find that this model gives suboptimal answers when asked about topics too advanced to show up with a lot of frequency in the training set. It sometimes does not make important connections, and may tend to hallucinate a pathway through plausible-sounding but wrong steps. For example, in coding problems, this model often uses methods that are not available in the given context or simply do not exist, even if they'd be convenient. Off-by-one errors and the like are also common.",2 — Rarely,2 — Rarely,"I usually verify answers from this model by following along its logic and seeing if it makes sense to me. It helps me learn the logic better myself, and is faster than coming up with logic from scratch, even if the model's logic is wrong. When given references, I make sure that they actually exist, as I have run into hallucinations before.",ChatGPT
74,"I would use this model for vibe coding tasks, prototyping projects, and to seek advice on life and the world. I prefer to use it for tasks that are more autonomous than other models.",2 — Unlikely,"Writing or debugging code,Explaining complex concepts simply,Drafting professional text (e.g., emails, résumés),Brainstorming or generating creative ideas",3 — Sometimes,"Math computations,Data processing or analysis,Converting content between formats (e.g., LaTeX)","I have found the model's responses for math computations suboptimal due to its suboptimal use of LaTeX in responses. The responses wind up being harder to read and less useful for learning when the core logic is stuck behind obtuse formatting, and I find myself reaching for other models in this case.",,2 — Rarely,"My verification of this model's responses, due to my use being majority for coding tasks, would be done by simply trying out the code. If it's for a one-off project, I don't really care to verify its output exactly, as long as it works well enough, but if I was using it in a more focused environment, I'd try to write tests and verify the code just as I would any human-written code.",Claude
74,"I would use this model to work through general-purpose analytical tasks, as well as leverage its diverse set of features for creative brainstorming and developing new ideas.",2 — Unlikely,"Writing or debugging code,Explaining complex concepts simply,Brainstorming or generating creative ideas",3 — Sometimes,"Math computations,Writing or debugging code","I find that the model's answers to math problems are often dissatisfactory, with similar problems to other models, where LaTeX formatting is strange and explanations feel somewhat lacking.",,2 — Rarely,"I would verify the model's responses just like any other model - by checking the work it gives, looking out for common off-by-one or miscounting errors, and verifying that any sources given truly exist.",Gemini
75,"Checking homework solutions, translating between languages, homework help,",5 — Very likely,"Explaining complex concepts simply,Writing or editing essays/reports,Drafting professional text (e.g., emails, résumés)",4 — Often,"Math computations,Writing or debugging code,Data processing or analysis","I told it to find all sentences with a given word, it gave me sentences that didn’t include the given word",1 — Never,5 — Very often,Manually check most of the response makes sense,ChatGPT
75,"Coding, data processing",2 — Unlikely,"Math computations,Writing or debugging code,Data processing or analysis,Converting content between formats (e.g., LaTeX)",3 — Sometimes,"Writing or editing essays/reports,Brainstorming or generating creative ideas",I asked for good puns and it gave me puns that didn’t make sense,2 — Rarely,3 — Sometimes,Manually verify the response makes sense,Claude
75,Nothing,1 — Not at all likely,,1 — Never,,Never used,1 — Never,1 — Never,Never used,Gemini
76,"Simple coding, emails, and explanations on a topic I don't know much about. I also use it to explain how to solve some math problems occasionally.",4 — Likely,"Writing or debugging code,Data processing or analysis,Explaining complex concepts simply,Converting content between formats (e.g., LaTeX),Drafting professional text (e.g., emails, résumés)",4 — Often,"Math computations,Writing or editing essays/reports,Brainstorming or generating creative ideas","There have been instances where I wanted to know how to solve some math problems however it would explain or solve it in a completely different way than I knew and would sometimes result in a wrong answer. Also, from my experience it tends to just agree with you. For example if you say ""no 1+1=2 is wrong"" it will apologize and give reasoning as to why it's wrong. However it may have improved from the last time I used it.",1 — Never,5 — Very often,I don't usually use AI for something I would need to verify. I suppose for a math problem I'd see if any online calculator can solve it or if I have the final answer to compare.,ChatGPT
76,I've used [THIS MODEL] in the past for coding. I've also used it to study for exams by inputting lots of previous exams and telling it to give me a list of the topics that were covered frequently and teach those topics to me.,2 — Unlikely,"Math computations,Writing or debugging code,Data processing or analysis,Explaining complex concepts simply,Converting content between formats (e.g., LaTeX)",2 — Rarely,"Writing or editing essays/reports,Brainstorming or generating creative ideas","Similar to all generative AI models, it would have trouble writing essays that seem like they're written by a human, however I believe [THIS MODEL] is better for coding so it is probably worse than others at writing.",1 — Never,3 — Sometimes,When I was studying for my exam using [THIS MODEL] I made sure to double check some information with the lecture slides and google.,Claude
76,I've never used [THIS MODEL] but it seems like an AI that is meant to help you for simpler tasks so maybe I'd use it for to-do lists.,1 — Not at all likely,"Converting content between formats (e.g., LaTeX),Drafting professional text (e.g., emails, résumés)",1 — Never,"Math computations,Writing or editing essays/reports,Brainstorming or generating creative ideas",I've never used this AI so I don't know about this one specifically however I believe AI is bad at generating creative ideas since they use data that already exists and will give unoriginal ideas. I believe humans are still better at creativity however that is just my opinion and I don't know factually.,1 — Never,1 — Never,I would search it on google to see if it is true.,Gemini
77,General purpose and academic tasks.,5 — Very likely,"Explaining complex concepts simply,Writing or editing essays/reports,Drafting professional text (e.g., emails, résumés),Brainstorming or generating creative ideas",3 — Sometimes,"Math computations,Data processing or analysis,Converting content between formats (e.g., LaTeX)","I asked the model to explain a multivariable calculus concept. It provided a multi-paragraph explanation with diagrams as a response. It was suboptimal because it either did not answer my question directly, or provided an example that appeared correct, but was wrong.",3 — Sometimes,4 — Often,"I usually use my own knowledge of the subject, or will consult external materials/sources when needed.",ChatGPT
77,Coding-related tasks.,3 — Neutral / Unsure,"Math computations,Writing or debugging code,Drafting professional text (e.g., emails, résumés)",2 — Rarely,Writing or debugging code,"A task for which the model can give a suboptimal response is coding a new feature. It will write the code needed to implement the feature, and present it to the user, with comments explaining certain decisions. It is suboptimal because it doesn't always consider all dependencies used, and the code may not actually work in testing.",,4 — Often,"Typically by walking through the code to verify that it does what it's supposed to, and then running the code to see if it actually works.",Claude
77,"I would use this model for tasks that require a large number of tokens, e.g. scanning large PDFs.",3 — Neutral / Unsure,"Data processing or analysis,Explaining complex concepts simply",3 — Sometimes,Writing or debugging code,"A task for which the model can give a suboptimal response is coding a new feature. It will write the code needed to implement the feature, and present it to the user, with comments explaining certain decisions. It is suboptimal because it doesn't always consider all dependencies used, and the code may not actually work in testing.",,3 — Sometimes,"I would verify it by running the code myself (if the model provides code), otherwise by checking other external sources.",Gemini
78,"Responding to messages/emails. Inquiries I have that I need a quick answer for (e.g. fitness, cooking) Asking for solutions to code. Asking for what functions to use from a large library that I am not familiar with",5 — Very likely,"Writing or debugging code,Explaining complex concepts simply,Converting content between formats (e.g., LaTeX),Writing or editing essays/reports,Drafting professional text (e.g., emails, résumés)",2 — Rarely,"Math computations,Data processing or analysis,Brainstorming or generating creative ideas","Complicated math problems, especially proofs or other abstract math. It messed up with the logic or chronology of the answer, reaching a certain outcome without any idea of how it reached it.",4 — Often,2 — Rarely,"I ask it why it isn’t wrong and seeing if its reason makes sense. For example, if it provides me a piece of code, i give it an edge case and ask if it still works. Then it will give me a step by step rundown of what happens in that edge case, and I use my reasoning to determine if it is correct",ChatGPT
78,I use [THIS MODEL] more for coding than I do [ANOTHER MODEL],4 — Likely,"Writing or debugging code,Data processing or analysis",2 — Rarely,"Explaining complex concepts simply,Writing or editing essays/reports,Drafting professional text (e.g., emails, résumés)","I don’t use [THIS MODEL] much but when I do I have noticed it doesn’t go into as much detail as [ANOTHER MODEL]. For this reason, I assume that it would be relatively suboptimal for things like explaining concepts.",4 — Often,3 — Sometimes,The same way I would for [ANOTHER MODEL],Claude
78,I use it when looking something up on google. It is the first thing I read before I search through any links.,5 — Very likely,"Explaining complex concepts simply,Writing or editing essays/reports,Drafting professional text (e.g., emails, résumés)",3 — Sometimes,"Math computations,Writing or debugging code,Data processing or analysis","I have never used it for coding because I assume that is not what most people would use it for. This is because it is integrated within the google workspace and hence is more likely to be optimized for professional text and information retrieval, rather than math computations or writing code.",5 — Very often,4 — Often,"When searching something on google, I would read the [THIS MODEL] summary first. Then I would visit the first few websites in the search results and verify if the info that I read is correct. For simple questions (e.g. how many g of protein in an egg) I don’t verify the answer [THIS MODEL] gives me.",Gemini
79,"Usually, for school or when I have specific questions that might be harder to find using a search engine",5 — Very likely,"Explaining complex concepts simply,Converting content between formats (e.g., LaTeX),Drafting professional text (e.g., emails, résumés),Brainstorming or generating creative ideas",3 — Sometimes,"Math computations,Writing or debugging code,Data processing or analysis","I asked it to solve a math equation, though the method it used was very convulated and the solution was incorrect",4 — Often,5 — Very often,"I usually either go through the response and try to identify some errors. Sometimes I may ask the model to explain its response, or I consult another source.",ChatGPT
79,Have only used it for coding tasks before,3 — Neutral / Unsure,Writing or debugging code,4 — Often,"Math computations,Writing or debugging code,Data processing or analysis","When I was asking it to debug some code, but the solution it gave didn't quite understand the problem and ran into the same issue",4 — Often,4 — Often,"I have only used this for coding before, and I verified by going through the response and running the code",Claude
79,General questions,3 — Neutral / Unsure,"Writing or debugging code,Writing or editing essays/reports,Drafting professional text (e.g., emails, résumés)",5 — Very often,"Math computations,Writing or debugging code,Data processing or analysis","Have only used this model to try to build chatbots. When querying it as a chatbot, it often did not give the information that was asked for or could not accurately locate the information.",4 — Often,5 — Very often,"When used for chatbots, I read through the response and checked if the information given is what I asked for.",Gemini
80,I use it for recipes by saying the ingredients I have. I also use it to make my meal plan and my workout schedule I also use it to help me understand the concepts taught in class more fully. I also use it to test myself after studying for tests. I also use it to polish my emails to look more professional.,1 — Not at all likely,"Explaining complex concepts simply,Drafting professional text (e.g., emails, résumés)",4 — Often,"Math computations,Writing or debugging code","If you ask it to write an essay, it sometimes makes up sources .",4 — Often,3 — Sometimes,"If i ask it to write an essay, I will go look at the sources it used.",ChatGPT
80,"Polishing the essay, paraphrasing something in a better way.",2 — Unlikely,"Writing or editing essays/reports,Drafting professional text (e.g., emails, résumés),Brainstorming or generating creative ideas",3 — Sometimes,"Math computations,Writing or debugging code,Data processing or analysis,Converting content between formats (e.g., LaTeX)","When asked for precise citations, it sometimes paraphrases poorly or gives vague references without direct links.",3 — Sometimes,5 — Very often,check if the references are correct,Claude
80,Draft emails explaining concepts,1 — Not at all likely,"Writing or editing essays/reports,Drafting professional text (e.g., emails, résumés)",2 — Rarely,"Math computations,Writing or debugging code,Data processing or analysis,Converting content between formats (e.g., LaTeX)",It provided an incorrect answer to a mathematical proof.,2 — Rarely,3 — Sometimes,"I use it to explain concepts at a deeper level, draft emails, and check my grammar.",Gemini
81,explain some difficult concepts. reading the slides. writing emails. some problems in life.,3 — Neutral / Unsure,"Data processing or analysis,Explaining complex concepts simply,Converting content between formats (e.g., LaTeX),Writing or editing essays/reports,Drafting professional text (e.g., emails, résumés)",3 — Sometimes,"Math computations,Writing or debugging code,Brainstorming or generating creative ideas","When I asked for fanfiction translation. What it gave: Faithful sentence-by-sentence translations, but sometimes too literal. Reason: Didn’t always adjust cultural nuances or slang for readability, so I had to polish some sections after.",3 — Sometimes,2 — Rarely,search on google look back on slides/course materials check by myself,ChatGPT
81,some simple coding work with some data read readings,3 — Neutral / Unsure,"Writing or debugging code,Data processing or analysis,Converting content between formats (e.g., LaTeX),Drafting professional text (e.g., emails, résumés)",3 — Sometimes,"Math computations,Writing or debugging code,Converting content between formats (e.g., LaTeX)","When writing a reading report, it didn't read the material i gave him and made up something itself.",3 — Sometimes,2 — Rarely,search on Google,Claude
