197,"I use [THIS MODEL] for pretty anything and it's my go to LLM. It answers almost any query I can have except really complex math or cs questions for which DeepSeek is much better. Sometimes I use [THIS MODEL] as adjunct to my personal therapist for personal tips and advice. I trust the data privacy at OpenAI. Recently, I have been using it for legal advice for a case that I am in.",5 — Very likely,"Explaining complex concepts simply,Writing or editing essays/reports,Drafting professional text (e.g., emails, résumés),Brainstorming or generating creative ideas",3 — Sometimes,"Math computations,Writing or debugging code,Data processing or analysis,Converting content between formats (e.g., LaTeX)","I once asked [THIS MODEL] to help me with a question in my MAT237 problem set. The question seemed too complex for [THIS MODEL] to even comprehend and understand it properly and the advice that it was giving was leading me in all sorts of wrong directions. Also, I tried making my own custom chrome extension using [THIS MODEL]'s code and it failed miserably with so many bugs even in the simplest of features.",4 — Often,2 — Rarely,I go the references that are provided in the response and look into them. Then also cross reference [THIS MODEL]'s answers with other credible official sources and other LLMs.,ChatGPT
197,"For long document tasks, or safety sensitive tasks or long form writing.",1 — Not at all likely,"Explaining complex concepts simply,Converting content between formats (e.g., LaTeX),Writing or editing essays/reports",3 — Sometimes,"Math computations,Writing or debugging code,Data processing or analysis,Drafting professional text (e.g., emails, résumés),Brainstorming or generating creative ideas","One task where [THIS MODEL] can give a suboptimal response is summarizing a very long technical document, such as a 300-page legal contract, into an executive brief. While [THIS MODEL]’s large context window allows it to read the entire document, it often produces a summary that is overly long—sometimes several thousand words—and preserves much of the original legal phrasing. This verbosity makes it difficult for a busy executive to quickly grasp the key issues. As a result, the summary is technically accurate but not strategically concise, which limits its usefulness for fast, high-level decision making.",4 — Often,3 — Sometimes,"To verify [THIS MODEL]’s response, I would first read it carefully to check that it directly answers the question and stays on topic. Next, I would fact-check any specific claims or data by consulting reliable sources such as peer-reviewed articles, reputable websites, or official documentation.",Claude
197,This LLM is very good to be used as an adjunct of [ANOTHER MODEL] for verifying important information. It's integration with google's search service makes it very good for searching the internet in a smart way to provide reliable information. It's math and coding is average and I rarely use it over DeepSeek or [ANOTHER MODEL],3 — Neutral / Unsure,"Data processing or analysis,Explaining complex concepts simply,Writing or editing essays/reports,Drafting professional text (e.g., emails, résumés),Brainstorming or generating creative ideas",2 — Rarely,"Math computations,Writing or debugging code,Data processing or analysis,Converting content between formats (e.g., LaTeX)",[THIS MODEL] can give suboptimal responses for complex math or coding problems that it has never seen before or the solution is not openly available on the internet.,4 — Often,2 — Rarely,I go the references that are provided in the response and look into them. Then also cross reference [THIS MODEL]'s answers with other credible official sources and other LLMs and other experts on internet and YouTube.,Gemini
198,"I use [THIS MODEL] meanly for solving the Logical issues, some academic problems or coding issues. For example, a piece of code have some bugs and I can't find it in nearly half hour, I might ask [THIS MODEL] for help.",4 — Likely,"Math computations,Writing or debugging code,Explaining complex concepts simply,Converting content between formats (e.g., LaTeX)",3 — Sometimes,"Writing or editing essays/reports,Drafting professional text (e.g., emails, résumés),Brainstorming or generating creative ideas","For example, I ask [THIS MODEL] for a idea about making up a small game with creativity, I give the game type and the structure and the model of that game is nearly the same as a game which is already in app store. I need some creative points for a new game, but it will always give me some ""combination"" of some existing game.",2 — Rarely,4 — Often,I will try to give the different prompt like give more relative descriptions or paraphrase the line I gave.,ChatGPT
198,Meanly for coding I think.,2 — Unlikely,Writing or debugging code,2 — Rarely,"Math computations,Writing or editing essays/reports,Drafting professional text (e.g., emails, résumés),Brainstorming or generating creative ideas","There is one Time I put my math issue in [THIS MODEL] mistakenly, as the suboptimal response seems not involve to my ""definition"" in book, just like irrelevant.",2 — Rarely,3 — Sometimes,"I mean, the code part not always wrong, I can just run the code in IDE to check the code. If the code have bugs, I will run it with bug again.",Claude
198,"I do not use it usually, but it seems similar as [ANOTHER MODEL], but without the project part which won't allow me to make my own ""subset""",2 — Unlikely,"Writing or debugging code,Data processing or analysis,Converting content between formats (e.g., LaTeX)",3 — Sometimes,"Math computations,Writing or editing essays/reports,Drafting professional text (e.g., emails, résumés)","I let it do a math proof, which is similar as the one I give to [ANOTHER MODEL], but without the given project, it cannot follow the formula and the logic in book to finish the proof, which make it wared.",3 — Sometimes,3 — Sometimes,"I give my response more examples with the example in class, which might be a little bit helpful. I just get some ideas from it finally.",Gemini
199,I would use this model to better understand lecture contents. I would ask it to explain the parts I struggle with in a simpler way and provide more examples to strengthen my understanding. I would also use this model for writing and editing emails.,4 — Likely,"Math computations,Explaining complex concepts simply,Drafting professional text (e.g., emails, résumés),Brainstorming or generating creative ideas",3 — Sometimes,"Writing or debugging code,Converting content between formats (e.g., LaTeX),Writing or editing essays/reports","I asked for a link to a paper I needed to use as evidence but the model gave me a paper without a proper source. When I asked for the references, it turned out the paper was not real and had just been generated by the model. I found this suboptimal because I needed reliable sources but the model provided something that looked real but was actually fabricated.",2 — Rarely,4 — Often,"I tried to verify a response when I asked for a practice problem or problem set answer. However, the question was theory based rather than computational, so I searched on Google to check if the response was actually correct.",ChatGPT
199,"I would use [THIS MODEL] for math computations such as solving equations, checking my calculations, and helping me understand step-by-step solutions.",1 — Not at all likely,Math computations,1 — Never,Writing or debugging code,"One task where the model gave a suboptimal response was debugging code. The model tried to fix errors, but the corrected code still contained issues and did not run properly.",1 — Never,1 — Never,"For coding tasks, I would verify the model’s response by running the code to check if it executes correctly and produces the expected output using my own test cases.",Claude
199,I would use [THIS MODEL] to help me summarize long readings and check my writing for grammar or clarity.,2 — Unlikely,"Explaining complex concepts simply,Drafting professional text (e.g., emails, résumés)",2 — Rarely,"Writing or debugging code,Converting content between formats (e.g., LaTeX)","One task where the model gave a suboptimal response was debugging code. Even after I asked it to fix the issues, the code was still incorrect and did not work properly.",2 — Rarely,3 — Sometimes,I would verify the model’s response by checking it against reliable sources or by testing it directly such as running the code or comparing it with class materials.,Gemini
200,lab research work (simple scripts) summarizing papers clarifying content i dont understand answer assingment questions,4 — Likely,"Writing or debugging code,Explaining complex concepts simply,Writing or editing essays/reports,Drafting professional text (e.g., emails, résumés)",4 — Often,"Math computations,Data processing or analysis,Converting content between formats (e.g., LaTeX),Drafting professional text (e.g., emails, résumés),Brainstorming or generating creative ideas","when Brainstorming or generating creative ideas, it often gives me very common and simple ideas.",2 — Rarely,3 — Sometimes,Test the code / read code over Internet searches,ChatGPT
200,Nothing,5 — Very likely,Math computations,3 — Sometimes,"Drafting professional text (e.g., emails, résumés)",,1 — Never,1 — Never,,Claude
200,Nothing,1 — Not at all likely,Writing or editing essays/reports,3 — Sometimes,Data processing or analysis,,1 — Never,1 — Never,,Gemini
201,"I would use [THIS MODEL] for almost everything in daily life, from small, practical tasks to helping me understand school concepts, and even for emotional support when I need to talk things out. It’s useful both for managing everyday details and for making sense of bigger ideas.",4 — Likely,"Explaining complex concepts simply,Writing or editing essays/reports,Drafting professional text (e.g., emails, résumés),Brainstorming or generating creative ideas",3 — Sometimes,"Math computations,Writing or debugging code,Data processing or analysis,Converting content between formats (e.g., LaTeX)","One time I asked the model to solve a math calculation, specifically a multiplication question. The response it gave looked confident but the number was actually wrong. I found this suboptimal because math tasks usually have a single correct answer, and giving the wrong number made me lose trust in the response.",2 — Rarely,2 — Rarely,"Usually the questions I ask don’t have one specific “correct” answer, so I don’t feel the need to verify them. If it’s something casual or open-ended, I just read the response and use it as is.",ChatGPT
201,"I would mainly use [THIS MODEL] for tasks like coding help and explaining concepts. It can walk me through problems step by step, clarify things I don’t fully understand, and make technical ideas easier to grasp.",4 — Likely,"Math computations,Writing or debugging code,Explaining complex concepts simply,Writing or editing essays/reports,Drafting professional text (e.g., emails, résumés),Brainstorming or generating creative ideas",3 — Sometimes,"Data processing or analysis,Converting content between formats (e.g., LaTeX)","One task where the model gave me a suboptimal response was when I asked about personal worries or emotional issues. The response was polite and supportive, but it sometimes felt too generic and not specific to my situation. I found this suboptimal because for emotional concerns, I was hoping for deeper understanding or more tailored advice rather than broad encouragement.",2 — Rarely,3 — Sometimes,"For coding or computational questions, I would verify the model’s response by directly testing the code or calculation. Running the code or checking the math result quickly shows whether the answer is correct or not.",Claude
201,"I rarely use [THIS MODEL], but if I do, it’s usually for simple and everyday questions. I would not rely on it for more complex or important tasks.",1 — Not at all likely,Explaining complex concepts simply,3 — Sometimes,"Math computations,Writing or debugging code,Data processing or analysis,Converting content between formats (e.g., LaTeX)","One task where the model gave a suboptimal response was answering a factual question. The response sounded fluent but the details were not completely correct. I found it suboptimal because I had to double-check the information elsewhere, which reduced my confidence in the answer.",2 — Rarely,2 — Rarely,I would verify the model’s response by doing a quick search online or checking a reliable source.,Gemini
202,"I would only use [THIS MODEL] to write emails, write resumes or job/academic related summaries and formatting things",3 — Neutral / Unsure,"Writing or editing essays/reports,Drafting professional text (e.g., emails, résumés)",4 — Often,"Math computations,Writing or debugging code,Data processing or analysis","Code fixing. [THIS MODEL] overlooks a lot of important things in the code when trying to fix it, usually leaving it worse.",2 — Rarely,4 — Often,"Spellchecking in word, fact look up, doing the math myself, running the code",ChatGPT
202,Code explaining and questions about popular libraries. Data analysis.,4 — Likely,"Writing or debugging code,Data processing or analysis,Converting content between formats (e.g., LaTeX)",2 — Rarely,Explaining complex concepts simply,Creative answers or ideas. For example when asking it to come up with creative new ideas it will usually not give good ideas.,3 — Sometimes,4 — Often,"looking up the facts, doing the math myself, or running the code",Claude
202,Real time information summary,1 — Not at all likely,Explaining complex concepts simply,3 — Sometimes,"Math computations,Writing or debugging code",Coding. It does not fix the code properly and ignores a lot of context in the code.,4 — Often,5 — Very often,"Fact checking, math checking, code documentation checking",Gemini
203,"Coding, debugging, math questions, health questions.",4 — Likely,"Math computations,Writing or debugging code,Data processing or analysis,Explaining complex concepts simply,Converting content between formats (e.g., LaTeX),Writing or editing essays/reports,Drafting professional text (e.g., emails, résumés),Brainstorming or generating creative ideas",3 — Sometimes,"Math computations,Writing or debugging code,Data processing or analysis",The response generally ignored my requirements or pretend that my requirements were something else.,2 — Rarely,3 — Sometimes,I ask the same questions in other AI like [ANOTHER MODEL] and [ANOTHER MODEL].,ChatGPT
203,"Coding, debugging.",2 — Unlikely,Writing or debugging code,2 — Rarely,Writing or debugging code,A suboptimal response usually give me extra features that I do not need without asking me first.,2 — Rarely,2 — Rarely,I ask the same questions in other AI like [ANOTHER MODEL] and [ANOTHER MODEL].,Claude
203,Math questions. Verifying responses from other AI models.,2 — Unlikely,"Math computations,Explaining complex concepts simply",2 — Rarely,,Suboptimal respons for math questions usually contains using an alternative version of a math theorem after I told it to not use a specific theorem to explain the question.,5 — Very often,2 — Rarely,I ask the same questions in other AI like [ANOTHER MODEL] and [ANOTHER MODEL].,Gemini
204,"I would use this model to provide hints for certain tasks or project, sometimes to verify the correctness of the homework. Some hints like how to start off the essay, because sometimes the information gets into the brain needs time to digest. Which in summary is like creativity, repeated tasks.",3 — Neutral / Unsure,"Writing or debugging code,Explaining complex concepts simply,Brainstorming or generating creative ideas",3 — Sometimes,"Writing or debugging code,Brainstorming or generating creative ideas","Sometimes debugging a piece of code, where provide detailed background info and error code, [THIS MODEL] insists its answer even though I told it is not what I want. I.E. ""[THIS MODEL] fix aaa= summary(sss)"" (assume sss is a csv file been upload) response: ""I come up with blahblahblah...(useless codes)"" true answer is that just import a function or library but it generates a bunch of irrelevant codes",2 — Rarely,4 — Often,Ask to double check and I will use deepseek or manually to compute or search the paragraph/ answer that has been provided,ChatGPT
204,"don't know, never use this ai before",1 — Not at all likely,"Math computations,Data processing or analysis",3 — Sometimes,"Explaining complex concepts simply,Brainstorming or generating creative ideas",i never used this before,3 — Sometimes,3 — Sometimes,i never used this,Claude
204,Coding because of colab,1 — Not at all likely,Writing or debugging code,2 — Rarely,Explaining complex concepts simply,"I asked [THIS MODEL] about explaining the code, it somehow doesn't explained as well as [ANOTHER MODEL] does",2 — Rarely,4 — Often,Same as the way to verify [ANOTHER MODEL] answer,Gemini
205,"Writing tasks, Academic tasks, proofs.",4 — Likely,"Converting content between formats (e.g., LaTeX),Writing or editing essays/reports,Drafting professional text (e.g., emails, résumés)",3 — Sometimes,"Data processing or analysis,Explaining complex concepts simply",The model did not accurately explain a proof in layman's terms.,2 — Rarely,4 — Often,ask the model to reword it's solution while expanding on intricate details.,ChatGPT
205,"Computation, and code debug.",2 — Unlikely,"Math computations,Writing or debugging code,Converting content between formats (e.g., LaTeX)",3 — Sometimes,"Explaining complex concepts simply,Writing or editing essays/reports",Essay response was sub optimal due to constant nuanced bias.,2 — Rarely,2 — Rarely,I would ask the question again but word it differently.,Claude
205,"Image generation, creative prompts.",2 — Unlikely,"Data processing or analysis,Brainstorming or generating creative ideas",3 — Sometimes,"Math computations,Writing or editing essays/reports",Sometimes the model fails to understand the prompt and provides an image that does not suit the user's needs.,2 — Rarely,2 — Rarely,Rewrite the prompt in a different way.,Gemini
206,For asking general questions to learn about a topic or have it explain a concept. Or to rewrite text to change the tone or to match a given format.,3 — Neutral / Unsure,"Converting content between formats (e.g., LaTeX),Drafting professional text (e.g., emails, résumés)",4 — Often,"Math computations,Brainstorming or generating creative ideas","I asked for a mathematical proof of a statement, and it used several keywords that were related but it was all pretty much nonsense.",2 — Rarely,5 — Very often,"If it is something mathematical, I check it over manually. If it is textual I read through it and make sure I like the phrasing.",ChatGPT
206,Asking to implement boilerplate code or generating unit tests for a function I just wrote.,3 — Neutral / Unsure,"Writing or debugging code,Converting content between formats (e.g., LaTeX),Writing or editing essays/reports",3 — Sometimes,"Math computations,Data processing or analysis,Brainstorming or generating creative ideas","I asked for ideas for birthday gifts and it gave a bunch of ideas that sound related to the topics I mentioned the recipient was interested in, but most were very impractical or not really gifts.",2 — Rarely,5 — Very often,"Reading over the response, and making sure it makes sense.",Claude
206,To ask questions about random things or to generate images or videos.,2 — Unlikely,Brainstorming or generating creative ideas,3 — Sometimes,Explaining complex concepts simply,I asked for an explanation of a concept and in the explanation it used a lot of concepts that are complicated in themselves without explaining what they meant.,2 — Rarely,3 — Sometimes,If it's an image I just see if it is what I wanted otherwise I try again with a new prompt.,Gemini
207,to help give solution to practice question or explain complex concept,4 — Likely,"Math computations,Explaining complex concepts simply,Converting content between formats (e.g., LaTeX),Writing or editing essays/reports",4 — Often,"Math computations,Writing or debugging code",I tried to make it simplify a kernel graph and it keeps making up a 1 in the graph,3 — Sometimes,4 — Often,I follow the steps to see if I understand it,ChatGPT
207,never used,1 — Not at all likely,Math computations,1 — Never,Math computations,never used,1 — Never,1 — Never,never used,Claude
207,I have never used this model,1 — Not at all likely,Math computations,1 — Never,Math computations,never used,1 — Never,1 — Never,never used,Gemini
208,"I use [THIS MODEL] for a wide range of tasks, but the most notable are tedious tasks (e.g. formatting a list to be used in my code) and supplementing my learning (e.g. asking it to explain a difficult concept like I'm five). Other tasks I use it for include how best to prepare for a big event in my life, or other random, everyday tasks that I need help doing.",5 — Very likely,"Writing or debugging code,Data processing or analysis,Explaining complex concepts simply,Converting content between formats (e.g., LaTeX)",3 — Sometimes,"Math computations,Writing or editing essays/reports,Drafting professional text (e.g., emails, résumés)","One time, I asked [THIS MODEL] a math question that I was confused about. The response was a step-by-step solution on how to solve the problem. However, upon reading the answer, it was clear that it made basic arithmetic errors in some steps, which led to a wrong solution.",3 — Sometimes,4 — Often,"I begin by googling anything from the response that makes me skeptical and check if any reliable sources agree with [THIS MODEL]'s response. If not, I check online forums to see if anyone has asked the same question as I did and the responses they received from others. If there is nothing useful, I always take the model's response with a grain of salt.",ChatGPT
208,"Although I do not use [THIS MODEL], I would use the model to help debug my code and for everyday problem-solving tasks. I might also use it to help me brainstorm ideas.",1 — Not at all likely,"Writing or debugging code,Data processing or analysis,Explaining complex concepts simply,Converting content between formats (e.g., LaTeX),Brainstorming or generating creative ideas",3 — Sometimes,"Math computations,Writing or editing essays/reports","When I give [THIS MODEL] a task that requires it to search the web, I often get a response with the wrong link attached next to some of the sentences. This is suboptimal because the point of attaching a link next to a sentence is for me to click on it and see the source of that statement, but if the links being attached are irrelevant, then this is a useless feature.",3 — Sometimes,4 — Often,"Since I do not use [THIS MODEL] as much as [ANOTHER MODEL], I might start verifying the model's response by asking [ANOTHER MODEL] the same question and seeing if the two responses match. If not, I would dive deeper with a Google search. If I am given sources by the models, I would look into them to further verify the responses.",Claude
208,"I use Google [THIS MODEL] whenever I do a Google search, and I get back an ""AI Overview"" response. The main task I use it for is asking questions that I want to know the answer to.",5 — Very likely,"Writing or debugging code,Explaining complex concepts simply,Converting content between formats (e.g., LaTeX),Brainstorming or generating creative ideas",5 — Very often,"Math computations,Explaining complex concepts simply","When I Google a question and the AI Overview box shows up, it often gives an incorrect answer or solution to my question.",5 — Very often,4 — Often,"Since I am already on Google when the AI Overview box shows up, and since it often provides a response that includes references or supporting evidence, I make sure to visit each of those references to make sure the information indeed matches and that the references themselves are reliable. I would also just scroll down to see the links that were provided from my Google search.",Gemini
209,"In order to help me understand study material and lecture notes, especially if there are a few concepts that I don't get during lectures, I could ask [THIS MODEL] to clarify certain concepts and give examples of how to do certain questions.",4 — Likely,"Math computations,Writing or debugging code,Data processing or analysis,Explaining complex concepts simply,Converting content between formats (e.g., LaTeX),Writing or editing essays/reports,Drafting professional text (e.g., emails, résumés),Brainstorming or generating creative ideas",2 — Rarely,"Explaining complex concepts simply,Converting content between formats (e.g., LaTeX),Writing or editing essays/reports","This is evident from when [THIS MODEL] tried to explain a calculus concept to me; they could not easily render the algebraic expressions clearly, and as such, I had to ask for re-explanations. Additionally, when explaining complex concepts, there are often times when it goes off the course topic, which, as a result, required me to dig deeper into what it wanted to explain.",2 — Rarely,3 — Sometimes,"Often, I ask it to re-explain the concepts in a way that I can understand and Google certain clarifications, like what it's trying to explain. To a certain extent, if there's a debugging issue, I read documentation from websites online to clarify the issue that I encountered.",ChatGPT
